{
  "contract": "1.0",
  "kind": "comparison",
  "suite": "contract-example",
  "run": "singlet",
  "caseId": "0318018e2bf0d3700b9594802bda35d77b49a9451eba43d7ea4f87bb49d7f1f8",
  "rung": "r1",
  "quantity": "paraxial.first-order",
  "requestId": "f73544fdaba65af6e6a55c5e146d8565b2e94185ba3154359ecda6f4a6ffd54f",
  "participants": [
    {
      "engine": "lv",
      "fingerprint": "a5218c82fa7cfc822c5f6e7412f7eb818985255f09a7cf211226e93069ece7e1",
      "status": "ok",
      "recorded": {
        "epZRelStop": [
          -12.5,
          null
        ],
        "magnification": [
          -0.25,
          -0.2501
        ]
      }
    },
    {
      "engine": "ref",
      "fingerprint": "874110a11991233d73d1cd46195d7b01cc20b4d99aad22116fc69474136bb4d6",
      "status": "ok",
      "recorded": {
        "magnification": [
          -0.25,
          -0.25
        ]
      }
    }
  ],
  "mode": "reference-vs-each",
  "reference": "ref",
  "pairs": [
    {
      "a": "ref",
      "b": "lv",
      "metrics": [],
      "class": "gated",
      "verdict": "BLOCKED",
      "reason": "not judged: rung r0 failed for lv and ref on this case"
    }
  ]
}
